,Unnamed: 0,Description,Corrected_Attribute,class
134,4430,"The p.V179I variant (also known as c.535G>A), located in coding exon 3 of the NTHL1 gene, results from a G to A substitution at nucleotide position 535. The valine at codon 179 is replaced by isoleucine, an amino acid with highly similar properties. In one in vitro functional study, this variant demonstrated repair activity for oxidative damage similar to wild type NTHL1 (Shinmura K et al. Free Radic. Biol. Med., 2019 02;131:264-273). This amino acid position is highly conserved in available vertebrate species. In addition, the in silico prediction for this alteration is inconclusive. Based on the available evidence, the clinical significance of this variant remains unclear.",['BS3'],Benign
135,4448,"The c.139C>T (p.R47*) alteration, located in exon 2 (coding exon 2) of the MCEE gene, consists of a C to T substitution at nucleotide position 139. This changes the amino acid from an arginine (R) to a stop codon at amino acid position 47. The predicted stop codon occurs in the 5' end of the MCEE gene. Premature termination codons in the 5 end of a gene have been reported to escape nonsense-mediated mRNA decay and/or lead to re-initiation (Rivas, 2015; Lindeboom, 2016; Rhee, 2017). Direct evidence for this alteration is unavailable, however premature termination codons are typically deleterious in nature. The c.139C>T (p.R47*) alteration has been reported in multiple individuals diagnosed with methylmalonyl-CoA epimerase deficiency in both the homozygous and compound heterozygous states (Abily-Donval, 2017; Andrasson, 2019; Bikker, 2006; Dobson, 2006; Gradinger, 2007; Heuberger, 2019; Waters, 2016). In vitro findings in cultured fibroblasts showed a decrease in propionate incorporation into macromolecules and normal activity of methylmalonyl-CoA mutase (Bikker, 2006). Based on the available evidence, this alteration is classified as pathogenic.",['BS3'],Benign
136,4474,"The p.V1808A variant (also known as c.5423T>C), located in coding exon 21 of the BRCA1 gene, results from a T to C substitution at nucleotide position 5423. The valine at codon 1808 is replaced by alanine, an amino acid with similar properties. This alteration shows intermediate function in a haploid cell survival assay as well as a yeast small colony phenotype assay (Findlay GM et al. Nature, 2018 10;562:217-222; Coyne RS et al. Cancer Biol. Ther., 2004 May;3:453-7). Additional analysis shows no defect in protein folding, and uncertain functionality in terms of transcriptional activation, and protein binding (Lee MS et al. Cancer Res. 2010 Jun;70:4880-90). Several computational methods predict this alteration has at lease a moderate destabilizing effect on the protein (Rowling PJ et al. J. Biol. Chem., 2010 Jun;285:20080-7; Mirkovic N et al. Cancer Res., 2004 Jun;64:3790-7; Williams RS et al. J. Biol. Chem., 2003 Dec;278:53007-16). This amino acid position is highly conserved in available vertebrate species. In addition, this alteration is predicted to be deleterious by in silico analysis. Since supporting evidence is limited at this time, the clinical significance of this alteration remains unclear.",['PS3'],Pathogenic
137,4563,"The c.-42C>T variant is located in the 5' untranslated region (5 UTR) of the MLH1 gene. This variant results from a C to T substitution 42 nucleotides upstream from the first translated codon. This alteration has been reported in multiple suspected-HNPCC/Lynch syndrome patients to date; however microsatellite instability (MSI) and immunohistochemistry (IHC) results from these individuals have been inconsistent (Mller-Koch Y et al. Eur. J. Med. Res. 2001; 6:473-82, Green RC et al. Clin. Genet. 2003; 64:220-7, Mangold E et al. Int. J. Cancer 2005; 116:692-702, Ward RL et al. Genet. Med. 2013; 15:25-35). Artificial promoter reporter assays have shown a c.-42C>T-associated reduction in activity between 37-80% of wild type levels (Green RC et al. Clin. Genet. 2003; 64:220-7, Ward RL et al. Genet. Med. 2013; 15:25-35). This nucleotide position is well conserved in available vertebrate species. Since supporting evidence is limited and conflicting at this time, the clinical significance of this alteration remains unclear.",['PS3'],Pathogenic
138,4680,"The c.6079A>G (p.K2027E) alteration is located in exon 34 (coding exon 34) of the NOTCH2 gene. This alteration results from a A to G substitution at nucleotide position 6079, causing the lysine (K) at amino acid position 2027 to be replaced by a glutamic acid (E). The alteration is not observed in healthy cohorts:_x000D_ Based on data from the NHLBI Exome Sequencing Project (ESP), the NOTCH2 c.6079A>G alteration was not observed among 6,497 individuals tested. Allele frequency data for this nucleotide position are not currently available from the 1000 Genomes Project and the alteration is not currently listed in the Database of Single Nucleotide Polymorphisms (dbSNP). Though some variants may appear to be rare due to database-specific ethnic underrepresentation, rare missense alleles commonly exhibit a deleterious effect on protein function (Kryukov, 2007; Tennessen, 2012). IF USED, PULL THESE INTO REFERENCES:_x000D_ Kryukov GV, et al. (2007) Am J Hum Genet 80:727-739. Tennessen JA, et al. (2012) Science 337(64):64-69. The altered nucleotide is conserved throughout evolution:_x000D_ The c.6079A nucleotide is well conserved in available vertebrate species, except the blowfish, stickleback, and the zebrafish._x000D_ _x000D_ The altered amino acid is conserved throughout evolution:_x000D_ The p.K2027 amino acid is completely conserved in available mammal species. The c.6079A>G (p.K2027E) alteration is located in coding exon 34 of the NOTCH2 gene. The alteration results from an A to G substitution at nucleotide position 6079, causing the Lysine (K) at amino acid position 2027 to be replaced by a Glutamic acid (E). The amino acid is located in a functionally important protein domain:_x000D_ The p.K2027E amino acid is located in the ankyrin repeat domain of the NOTCH2 protein. The ankyrin repeat domain is located in the intracellular part of the NOTCH2 protein and mediates protein-protein interactions. Pathogenic alterations in the ankyrin repeat domain are associated with Alagille syndrome and are predicted to affect the ability of the Notch intracellular domain to bind to other transcription factors (Penton, 2012). In silico prediction is conflicting:_x000D_ The p.K2027E alteration is predicted to be benign by Polyphen and deleterious by SIFT in silico analyses._x000D_ The alteration is predicted not to affect splicing by in silico models:_x000D_ Based on BDGP and ESEfinder splice site in silico tools, this alteration does not have any significant effect on the native acceptor/donor splice site; however, direct evidence is unavailable Based on insufficient or conflicting evidence, the clinical significance of this alteration remains unclear.",['PS3'],Pathogenic
139,4732,"The c.989-296_1144+706del1158 gross deletion spans coding exon 10 of the PMS2 gene. The resulting transcript is predicted to be in-frame and is not expected to trigger nonsense-mediated mRNA decay. The exact functional effect of the missing amino acids is unknown; however, gross deletions are typically deleterious in nature. This gross deletion has been reported as a founder mutation in the Caucasian population and has been identified in numerous hereditary non-polyposis colon cancer (HNPCC)/Lynch syndrome patients, many of whom had tumors with isolated loss of PMS2 on immunohistochemistry (IHC) (Hendriks YM et al. Gastroenterology, 2006 Feb;130:312-22; van der Klift HM et al. Hum Mutat, 2010 May;31:578-87; Vaughn CP et al. Hum Mutat, 2010 May;31:588-93; Tomsic J et al. Clin Genet, 2013 Mar;83:238-43; Jri B et al. Oncotarget, 2015 Dec;6:41108-22; Buchanan DD et al. J Gastroenterol Hepatol, 2017 Feb;32:427-438). A gross deletion in this region has also been reported in a Spanish Lynch syndrome family study and the proband was diagnosed with colorectal cancer at age 50 that demonstrated isolated loss of PMS2 on IHC (Brea-Fernandez AJ et al. Clin. Genet. 2014 Jun;85:583-8). In addition, a gross deletion in this region has been reported in trans with another PMS2 alteration in a French individual with clinical features of constitutional mismatch repair deficiency (CMMRD) syndrome such as caf au lait spots, a glioblastoma diagnosed at age 40, and early-onset colorectal cancers diagnosed at the ages of 22, 32, 42 (Lavoine N et al. J. Med. Genet. 2015 Nov;52:770-8). As such, this alteration is interpreted as a disease-causing mutation.",['PS3'],Pathogenic
140,4734,"The p.L138S variant (also known as c.413T>C), located in coding exon 4 of the BRIP1 gene, results from a T to C substitution at nucleotide position 413. The leucine at codon 138 is replaced by serine, an amino acid with dissimilar properties. This variant has been reported in 1/1120 pediatric cancer patients younger than age 20 who underwent whole genome and/or whole exome sequencing (Zhang J et al. N. Engl. J. Med. 2015 Dec;373:2336-2346). In a case-control study of the BRIP1 gene in familial breast cancer, this variant was seen in 1/13213 cases and 2/5242 controls (Easton DF et al. J. Med. Genet. 2016 05;53:298-309). It has also been reported in 1/1162 patients with sarcoma (Ballinger ML et al. Lancet Oncol. 2016 Sep;17:1261-71). This amino acid position is highly conserved in available vertebrate species. In addition, the in silico prediction for this alteration is inconclusive. Based on the available evidence, the clinical significance of this variant remains unclear.",['PS4'],Pathogenic
141,4755,"The p.D172N variant (also known as c.514G>A), located in coding exon 4 of the LDLR gene, results from a G to A substitution at nucleotide position 514. The aspartic acid at codon 172 is replaced by asparagine, an amino acid with highly similar properties. This alteration has been reported in multiple patients with familial hypercholesterolemia from different origins (Jensen HK et al. Atherosclerosis, 1999 Oct;146:337-44; Leren TP et al. Semin Vasc Med, 2004 Feb;4:75-85; Mozas P et al. Hum. Mutat., 2004 Aug;24:187; Chater R et al. Clin. Chim. Acta, 2006 Nov;373:62-9). This alteration was reported to segregate with the disease in the proband and three affected family members (Chater R et al. Clin. Chim. Acta, 2006 Nov;373:62-9). In vitro experiments suggested that this alteration resulted in deficient ligand binding while not affecting protein expression (Etxebarria A et al. Atherosclerosis, 2015 Feb;238:304-12). This amino acid position is not well conserved in available vertebrate species. In addition, the in silico prediction for this alteration is inconclusive. Based on the majority of available evidence to date, this variant is likely to be pathogenic.",['PS3'],Pathogenic
142,4780,"The p.F1271L variant (also known as c.3813C>A), located in coding exon 25 of the ALK gene, results from a C to A substitution at nucleotide position 3813. The phenylalanine at codon 1271 is replaced by leucine, an amino acid with highly similar properties. In an assay testing ALK function, this variant was considered non-activating when compared to known kinase activating mutations (Patil K et al. Proc Natl Acad Sci U S A, 2021 Mar;118:). This amino acid position is highly conserved in available vertebrate species. In addition, this alteration is predicted to be deleterious by in silico analysis. Based on the available evidence, the clinical significance of this alteration remains unclear.",['PS3'],Pathogenic
143,4808,"The p.P930L variant (also known as c.2789C>T), located in coding exon 9 of the BRCA1 gene, results from a C to T substitution at nucleotide position 2789. The proline at codon 930 is replaced by leucine, an amino acid with similar properties. In one study, this variant was found to be deleterious by SIFT and not deleterious by Ancestral Sequence method using 57 species (Pavlicek et al. Hum Mol Genet. 2004; 13:27372751). These findings were duplicated in a second study that predicted p.P930L was not deleterious using an expanded set of alignments from 132 species (Burk-Herrick et al. Mamm. Genome 2006 Mar;17(3):257-70). This amino acid position is poorly conserved in available vertebrate species. In addition, the in silico prediction for this alteration is inconclusive. Since supporting evidence is limited at this time, the clinical significance of this alteration remains unclear.",['PS3'],Pathogenic
144,4838,"The c.-2C>T variant is located in the 5' untranslated region (5 UTR) of the CRYAB gene. This variant results from a C to T substitution 2 bases upstream from the first translated codon. This variant may impact initiation of translation by altering the Kozak consensus sequence. However, experimental evidence is not available, and the potential impact of CRYAB loss of function in cardiomyopathy is unclear. Furthermore, this nucleotide position is not well conserved in available vertebrate species. Since supporting evidence is limited at this time, the clinical significance of this alteration remains unclear.",['PS3'],Pathogenic
145,4847,"The p.A155T variant (also known as c.463G>A), located in coding exon 4 of the CBS gene, results from a G to A substitution at nucleotide position 463. The alanine at codon 155 is replaced by threonine, an amino acid with similar properties. This variant has been detected, reportedly in trans, with pathogenic or likely pathogenic variants in CBS in individuals with homocystinuria or related features; however, the p.A155T variant also occurred in cis with an additional CBS variant (p.E144K, c.430G>A) in most reported cases, confounding the interpretation of the role of p.A155T. In addition, several published cases likely include overlapping patient reports (Kraus JP et al. Hum. Mutat., 1999;13:362-75; Janosk M et al. Am. J. Hum. Genet., 2001 Jun;68:1506-13; Orendc M et al. J. Inherit. Metab. Dis., 2003;26:761-73; Linnebank M et al. Hum. Mutat., 2004 Oct;24:352-3Magner M et al. J. Inherit. Metab. Dis., 2011 Feb;34:33-7). In a yeast growth assay, this variant was indicated to have approximately 50%-60% retained activity in low-pyridoxine conditions (Mayfield JA et al. Genetics, 2012 Apr;190:1309-23; Kasak L et al. Hum. Mutat., 2019 09;40:1530-1545). One study reported this variant to result in abnormal protein aggregates, impaired heme-binding, and absent catalytic activity in a bacterial model; however, data regarding studies of catalytic activity were limited (Janosk M et al. Am. J. Hum. Genet., 2001 Jun;68:1506-13). This amino acid position is highly conserved in available vertebrate species. In addition, this alteration is predicted to be deleterious by in silico analysis. Since supporting evidence is limited at this time, the clinical significance of this alteration remains unclear.",['BS3'],Benign
146,4861,"The c.1978G>A (p.G660R) alteration is located in exon 12 (coding exon 11) of the SV2A gene. This alteration results from a G to A substitution at nucleotide position 1978, causing the glycine (G) at amino acid position 660 to be replaced by an arginine (R). Based on data from gnomAD, the A allele has an overall frequency of <0.001% (1/251288) total alleles studied. The highest observed frequency was 0.003% (1/34586) of Latino alleles. This variant was reported de novo in one individual and heterozygous in an unrelated family with seizures and cafe au lait spots (Calame, 2021; Badura-Stronka, 2023). This amino acid position is highly conserved in available vertebrate species. This alteration is predicted to be deleterious by in silico analysis. Based on insufficient or conflicting evidence, the clinical significance of this alteration remains unclear.",['PS2'],Pathogenic
147,4883,"The p.L698R variant (also known as c.2093T>G), located in coding exon 15 of the TSC1 gene, results from a T to G substitution at nucleotide position 2093. The leucine at codon 698 is replaced by arginine, an amino acid with dissimilar properties. A functional study reported that this variant was probably neutral in a transfection-based immunoblot assay of S6 phosphorylation (Hoogeveen-Westerveld M et al. Hum Mutat, 2012 Mar;33:476-9). This amino acid position is well conserved in available vertebrate species. In addition, this alteration is predicted to be deleterious by in silico analysis. Based on the available evidence, the clinical significance of this alteration remains unclear.",['BS3'],Benign
148,4885,"The p.G750D pathogenic mutation (also known as c.2249G>A), located in exon 13 of the PMS2 gene, results from a G to A substitution at nucleotide position 2249. The glycine at codon 750 is replaced by aspartate, an amino acid with similar properties. In one study, this alteration was detected in trans with a full gene PMS2 deletion and the severe phenotype in this family was consistent with biallelic PMS2 mutations. The proband was diagnosed with rectal cancer at age 22 and a brain tumor at age 23, while a brother was diagnosed with colorectal cancer (CRC) at age 21. The proband's tumor as well as adjacent normal tissue demonstrated loss of PMS2 expression on IHC (Senter et al. Gastroenterology. 2008 August; 135(2): 419428). In another family, the p.G750D alteration was reported in conjunction with the PMS2 frameshift mutation c.2019delT in a proband with caf-au-lait macules, a glioblastoma at age 31, and CRC at age 32. Tumor testing showed MSI-H and absence of PMS2 staining on IHC. This patient's family history included hematologic cancers, renal cancer, and CRC (van Galen et al. Hereditary Cancer in Clinical Practice. 2011, 9(Suppl 1):P38). This alteration was also reported in a suspected Lynch syndrome family and the proband had co-occurrence with PMS2 p.E330_E381del. The clinical features of the proband included: CRC diagnosed twice at ages 22 and 32, polyps at age 38, a glioblastoma at age 40, and caf-au-lait macules (Lavoine N et al. J. Med. Genet. 2015 Nov;52:770-8). In another study, this alteration was reported in conjunction with PMS2 p.S46I in a male with colon cancer diagnosed at ages 41 and 50 and tumor results demonstrated MSI-H as well as loss of PMS2 expression on IHC (Goodenberger ML et al. Genet. Med. 2016 Jan;18:13-9). Based on an internal structural analysis, this variant is anticipated to result in a significant decrease in protein structural stability (Gueneau E et al. Nat. Struct. Mol. Biol. 2013 Apr; 20(4):461-8). This missense alteration is located in a region that has a low rate of benign missense variation (Lek M et al. Nature. 2016 Aug 18;536(7616):285-91; DECIPHER: Database of Chromosomal Imbalance and Phenotype in Humans using Ensembl Resources. Firth H.V. et al. 2009. Am.J.Hum.Genet. 84, 524-533 (DOI: dx.doi.org/10/1016/j.ajhg.2009.03.010)). This variant is considered to be rare based on population cohorts in the Genome Aggregation Database (gnomAD). This amino acid position is highly conserved in available vertebrate species. In addition, this alteration is predicted to be deleterious by in silico analysis. Based on the supporting evidence, this alteration is interpreted as a disease-causing mutation.",['PM3'],Pathogenic
149,4912,"The p.R268Q variant (also known as c.803G>A), located in coding exon 2 of the HOXB13 gene, results from a G to A substitution at nucleotide position 803. The arginine at codon 268 is replaced by glutamine, an amino acid with highly similar properties. In a Dutch case-control study, this alteration was reported in 1/1206 non-BRCA1/2 familial breast cancer cases and 0/765 controls (Liu J et al. Sci Rep. 2016 Jul;6:30026). This amino acid position is highly conserved in available vertebrate species. In addition, this alteration is predicted to be deleterious by in silico analysis. Since supporting evidence is limited at this time, the clinical significance of this alteration remains unclear.",['PS4'],Pathogenic
150,4919,"The alteration results from an in-frame insertion/deletion: _x000D_ _x000D_ The c.10256_10262delACTTTACins19 (p.N3419_T3421delinsTFALCSD) alteration, located in exon 52 (coding exon 51) of the USH2A gene, results from an in-frame deletion of 7 and insertion of 19 nucleotides from position 10256 to 10262. This results in the substitution of asparagine, phenylalanine, and threonine residues for 7 alternative residues between codon 3419 and 3421. The alteration is rare in population databases: _x000D_ _x000D_ Based on data from the Genome Aggregation Database (gnomAD), the c.10256_10262delACTTTACins19 alteration was observed in 3 alleles in the Latino subpopulation, with a frequency of 0.0012% of total alleles studied and 0.0087% of Latino subpopulation alleles. The alteration is predicted deleterious by in silico modeling:_x000D_ _x000D_ The c.10256_10262delACTTTACins19 alteration is predicted to be deleterious with a score of -10.507 by PROVEAN in silico analysis. Based on insufficient or conflicting evidence, the clinical significance of this alteration remains unclear.",['PS3'],Pathogenic
151,4924,"The p.A195S variant (also known as c.583G>T), located in coding exon 5 of the RECQL gene, results from a G to T substitution at nucleotide position 583. The alanine at codon 195 is replaced by serine, an amino acid with similar properties. This amino acid position is highly conserved in available vertebrate species. This alteration has been reported in a breast cancer patient and functional studies performed have demonstrated abnormal function (Sun J et al. PLoS Genet, 2015 May;11:e1005228; Parvathaneni S et al. J Biol Chem, 2019 10;294:15330-15345). In addition, this alteration is predicted to be tolerated by in silico analysis. Since supporting evidence is limited at this time, the clinical significance of this alteration remains unclear.",['PS3'],Pathogenic
152,4962,"The p.Q548* pathogenic mutation (also known as c.1642C>T), located in coding exon 6 of the BLM gene, results from a C to T substitution at nucleotide position 1642. This changes the amino acid from a glutamine to a stop codon within coding exon 6. This mutation has been identified in the homozygous and compound heterozygous state with another pathogenic BLM mutation in multiple individuals with Bloom syndrome (German J et al. Hum. Mutat. 2007 Aug;28:743-53; Classen CF et al. Hum. Genet. 2013 Jul;132:825-41; Suspitsin EN et al. Mol Syndromol 2017 Mar;8(2):103-106). It has also been identified in the heterozygous state in individuals with breast cancer, prostate cancer, and colorectal cancer and is considered a possible Slavic founder mutation (Sokolenko AP et al. Int. J. Cancer. 2012 Jun;130:2867-73; Prokofyeva D et al. Breast Cancer Res. Treat. 2013 Jan;137:533-9; Lhota F et al. Clin. Genet. 2016 Oct;90:324-33; Maxwell KN et al. Am. J. Hum. Genet. 2016 May;98:801-17; deVoer RM et al. Sci Rep 2015 Sep;5:14060; Antczak A et al. Gene 2013 Dec;532(2):173-6). One case-control study in Poland identified this mutation in 82/14804 unselected breast cancer cases and 26/4698 cancer-free women (Kluzniak W et al. Cancers (Basel) 2019 Oct;11(10)). In addition to the clinical data presented in the literature, this alteration is expected to result in loss of function by premature protein truncation or nonsense-mediated mRNA decay. As such, this alteration is interpreted as a disease-causing mutation.",['PS4'],Pathogenic
153,4965,"The p.I691L variant (also known as c.2071A>C), located in coding exon 13 of the BRIP1 gene, results from an A to C substitution at nucleotide position 2071. The isoleucine at codon 691 is replaced by leucine, an amino acid with highly similar properties. This variant has been identified individuals with breast and ovarian cancer as well as unaffected controls (Tung N et al. J. Clin. Oncol. 2016 May;34(13):1460-8; Easton DF et al. J. Med. Genet., 2016 05;53:298-309; Moyer CL et al. Cancer Res. 2020 Feb;80:857-867; Ramus SJ et al. J. Natl. Cancer Inst. 2015 Nov;107(11)). Based on results from an inter-strand cross link damage survival assay, this variant was characterized as hypomorphic by one group (Moyer CL et al. Cancer Res. 2020 Feb;80:857-867). This amino acid position is well conserved in available vertebrate species. In addition, the in silico prediction for this alteration is inconclusive. Based on the available evidence, the clinical significance of this variant remains unclear.",['PS3'],Pathogenic
154,5327,"The p.Q80R variant (also known as c.239A>G), located in coding exon 1 of the GJB1 gene, results from an A to G substitution at nucleotide position 239. The glutamine at codon 80 is replaced by arginine, an amino acid with highly similar properties. This alteration has been detected in individuals with features consistent with Charcot-Marie-Tooth neuropathy X type 1 (CMTX1); however, clinical details were limited (Mersiyanova IV et al. Hum Mutat, 2000;15:340-7; Ionasescu V et al. Am J Med Genet, 1996 Jun;63:486-91). Functional studies in vitro have shown that Q80R retains its ability to form homotypic junctional channels, similar to wild-type cells (Wang HL et al. Neurobiol Dis, 2004 Mar;15:361-70). This amino acid position is highly conserved in available vertebrate species. In addition, this alteration is predicted to be deleterious by in silico analysis. Since supporting evidence is limited at this time, the clinical significance of this alteration remains unclear.",['BS3'],Benign
