,Unnamed: 0,Description,Corrected_Attribute,class
70,1972,"The p.R751L variant (also known as c.2252G>T), located in coding exon 14 of the CFTR gene, results from a G to T substitution at nucleotide position 2252. The arginine at codon 751 is replaced by leucine, an amino acid with dissimilar properties. This alteration, along with the deltaF508 pathogenic mutation, was described in an individual who presented with pancreatic sufficient cystic fibrosis. However, information if this alteration was in cis or trans with deltaF508 was not available (Goubau C et al. Thorax 2009; 64:683-91). Functional studies demonstrated that this variant is functional and biochemical responses were similar to the wildtype CFTR protein level (Haq IJ et al. Am J Physiol Lung Cell Mol Physiol, 2021 Feb;320:L288-L300). This amino acid position is well conserved in available vertebrate species. In addition, this alteration is predicted to be deleterious by in silico analysis. Based on the available evidence, the clinical significance of this variant remains unclear.",['BP2'],Both
71,1975,"The p.G453E variant (also known as c.1358G>A), located in coding exon 12 of the CBS gene, results from a G to A substitution at nucleotide position 1358. The amino acid change results in glycine to glutamic acid at codon 453, an amino acid with similar properties. This alteration is located in the regulatory domain of CBS protein. However, this change occurs in the last base pair of coding exon 12, which makes it likely to have some effect on normal mRNA splicing. In an in vitro study in yeast, the p.G453E showed comparable enzyme activity to the wild type. In addition, when expressed in cis with a pathogenic mutation, this variant was shown to rescue the yeast phenotype and restore the enzyme activity to a limited extent (Shan X et al, Hum. Mol. Genet. 2001 Mar; 10(6):635-43). However, the potential impact this variant has on splicing was not addressed in that study. This nucleotide position is highly conserved in available vertebrate species. This amino acid position is highly conserved in available vertebrate species. In silico splice site analysis for this alteration is inconclusive. In addition, as a missense substitution this is predicted to be deleterious by in silico analysis. Since supporting evidence is limited at this time, the clinical significance of this alteration remains unclear.",['BS3'],Benign
72,1993,"The c.373_375delGTC variant (also known as p.V125del) is located in coding exon 4 of the LZTR1 gene. This variant results from an in-frame GTC deletion at nucleotide positions 373 to 375. This results in the in-frame deletion of a valine at codon 125. This variant has been reported in a 46 year-old individual with three lower limb schwannomas (Paganini I et al. Eur J Hum Genet, 2015 Jul;23:963-8). Based on internal analysis, the p.V125del variant is predicted to be structurally deleterious. This amino acid position is highly conserved in available vertebrate species. In addition, this alteration is predicted to be deleterious by in silico analysis (Choi Y et al. PLoS ONE. 2012; 7(10):e46688). Since supporting evidence is limited at this time, the clinical significance of this alteration remains unclear.",['PS3'],Pathogenic
73,1998,"The c.258_261delAAGG variant, located in coding exon 3 of the TMEM43 gene, results from a deletion of 4 nucleotides at nucleotide positions 258 to 261, causing a translational frameshift with a predicted alternate stop codon (p.R87Wfs*26). This variant has been detected through exome sequencing in a cohort not selected for the presence of cardiovascular disease; however, details were limited (Van Hout CV et al. Nature, 2020 10;586:749-756). This alteration is expected to result in premature protein truncation or nonsense-mediated mRNA decay. However, loss of function of TMEM43has not been clearly established as a mechanism of disease. Since supporting evidence is limited at this time, the clinical significance of this alteration remains unclear.",['PS3'],Pathogenic
74,2046,"The p.L219S variant (also known as c.656T>C), located in coding exon 4 of the RAD51C gene, results from a T to C substitution at nucleotide position 656. The leucine at codon 219 is replaced by serine, an amino acid with dissimilar properties. In one study, this variant was identified in a Spanish breast and ovarian cancer family and was absent in 550 general population controls (Osorio A et al. Hum. Mol. Genet. 2012 Jul;21:2889-98). When expressed in RAD51C-deficient cells, this variant was not able to restore normal function. This alteration was also reported in a Spanish female diagnosed with ovarian cancer at age 44 and having a family history of breast cancer and prostate cancer (Blanco A et al. Breast Cancer Res. Treat. 2014 Aug;147:133-43). The p.L219S variant was analyzed for homologous recombination (HR) efficiency using a GFP reporter and exhibited significantly reduced HR frequency (Somyajit K et al. Carcinogenesis. 2015 Jan;36:13-24). Authors also demonstrated that this variant displayed 3-fold sensitivity toward PARP inhibitors using CL-V4B cells incubated with 4-ANI. This amino acid position is highly conserved in available vertebrate species. In addition, this alteration is predicted to be deleterious by in silico analysis. Since supporting evidence is limited at this time, the clinical significance of this alteration remains unclear.",['PS3'],Pathogenic
75,2096,"The c.682-1G>C intronic variant results from a G to C substitution one nucleotide upstream from coding exon 8 of the BRCA2 gene. This alteration (designated as IVS8-1G>C) was identified in a Sri Lankan patient diagnosed with both breast and ovarian cancer at age 46, who also had a family history of breast cancer (De Silva S et al. Exp Ther Med. 2011 Nov; 2(6):1163-1170). This variant was previously reported in the SNPDatabase as rs81002831, but was absent from population-based cohorts in the NHLBI Exome Sequencing Project (ESP) and 1000 Genomes Project databases. To date, this alteration has been detected with an allele frequency of approximately 0.001% (greater than 300000 alleles tested) in our clinical cohort. This nucleotide position is highly conserved in available vertebrate species. Using the BDGP and ESEfinder splice site prediction tools, this alteration is predicted to abolish the native splice acceptor site; however, direct evidence is unavailable. A third model predicts that this alteration will weaken the native splice acceptor site (Mucaki EJ et al. Hum. Mutat. 2011 Jul; 32(7):735-42). Alterations that disrupt the canonical splice acceptor site are typically deleterious in nature (ACMG Recommendations for Standards for Interpretation and Reporting of Sequence Variations. Revision 2007. Genet Med. 2008; 10:294). As such, the c.682-1G>C variant is classified as likely pathogenic.",['PS3'],Pathogenic
76,2108,"The p.T476M variant (also known as c.1427C>T), located in coding exon 12 of the CHEK2 gene, results from a C to T substitution at nucleotide position 1427. The threonine at codon 476 is replaced by methionine, an amino acid with similar properties. Recent case-control studies have reported association with breast cancer risk with odds ratios ranging from 1.35 to 1.63 (Dorling et al. N Engl J Med. 2021 02;384:428-439; Bychkovsky BL et al. JAMA Oncol. 2022 Sep). Functional studies of this alteration have reported conflicting findings. In one in vivo, yeast-based growth rate assay, this variant was indicated to be semi-functional (Delimitsou A. Hum Mutat. 2019 05;40(5):631-648). However, several other studies have reported the variant as deleterious based on kinase and DNA damage response activity (Desrichard A et al. Breast Cancer Res. 2011 Nov;13:R119; Roeb W et al. Hum. Mol. Genet. 2012 Jun;21:2738-44). Another study reported this alteration as deleterious in an in vitro assay of kinase activity using bacterially expressed CHEK2, but neutral in an assay conducted in a human cell line (Kleiblova P et al Int J Cancer. 2019 10;145(7):1782-1797). This amino acid position is well conserved in available vertebrate species. In addition, the in silico prediction for this alteration is inconclusive. Based on the majority of available evidence to date, this variant is interpreted as a moderate risk mutation, also referred to as an established risk allele.",['PS3'],Pathogenic
77,2125,"The c.764_766delTCA variant (also known as p.I255del) is located in coding exon 6 of the TP53 gene. This variant results from an in-frame TCA deletion at nucleotide positions 764 to 766. This results in the in-frame deletion of an isoleucine at codon 255. This alteration has been reported as de novo in a proband with bilateral breast cancer at age 32, and also in this individual's child with a high-grade brain tumor diagnosed at age 2 (Quinn E et al. Cold Spring Harb Mol Case Stud 2019 08;5(4)). This alteration has also been identified in an individual with both early-onset breast cancer and astrocytoma (Melhem-Bertrandt A et al. Cancer 2012 Feb;118(4):908-13). Based on internal structural analysis, p.I255del is considered deleterious to protein structure (Ambry internal data; Golovenko D et al. Structure 2018 09;26(9):1237-1250.e6). This variant was not reported in population-based cohorts in the Genome Aggregation Database (gnomAD). This amino acid position is well conserved in available vertebrate species. Based on the majority of available evidence to date, this variant is likely to be pathogenic.",['PS3'],Pathogenic
78,2198,"The c.1877G>C (p.G626A) alteration is located in exon 6 (coding exon 6) of the ATP7B gene. This alteration results from a G to C substitution at nucleotide position 1877, causing the glycine (G) at amino acid position 626 to be replaced by an alanine (A). Based on data from gnomAD, the C allele has an overall frequency of 0.009% (24/280910) total alleles studied. The highest observed frequency was 0.097% (10/10362) of Ashkenazi Jewish alleles. This alteration was detected in conjunction with another alteration in ATP7B in multiple individuals with Wilson disease (Collins, 2021; Ljubic, 2016; Coffey, 2013). This amino acid position is highly conserved in available vertebrate species. Multiple functional assays show no significant alterations to copper transport activity in vitro (Hsi, 2008; Huster, 2012; Braiterman, 2014). This alteration is predicted to be deleterious by in silico analysis. Based on the available evidence, this alteration is classified as pathogenic.",['BS3'],Benign
79,2205,"The p.R196Q variant (also known as c.587G>A), located in coding exon 5 of the TP53 gene, results from a G to A substitution at nucleotide position 587. The arginine at codon 196 is replaced by glutamine, an amino acid with highly similar properties. This alteration was identified in a 6-year-old male with aplastic anemia and has also been reported in multiple breast cancer cases (Keel SB et al. Haematologica 2016 11;101(11):1343-1350; Momozawa Y et al. Nat Commun, 2018 10;9:4083; Bakhuizen JJ et al. Fam Cancer, 2019 04;18:273-280; Dorling et al. N Engl J Med, 2021 02;384:428-439). This variant is in the functionally critical DNA binding domain of the TP53 protein, is reported to have partial loss of transactivation capacity, and is predicted to affect all p53 isoforms (Kato S et al. Proc Natl Acad Sci USA. 2003 Jul 8; 100(14):8424-9). One yeast-based functional assay did not show this alteration to have a dominant negative effect (Marutani M et al. Cancer Res. 1999 Oct;59(19):4765-9). Studies conducted in human cell lines indicate this alteration is proficient at growth suppression and has no dominant negative effect (Kotler E et al. Mol.Cell. 2018 Jul;71:178-190.e8; Giacomelli AO et al. Nat. Genet. 2018 Oct;50:1381-1387). Based on internal structural analysis, this variant is anticipated to result in a significant decrease in structural stability (Eldar A et al. Nucleic Acids Res, 2013 Oct;41:8748-59). This amino acid position is highly conserved in available vertebrate species. In addition, this alteration is predicted to be deleterious by in silico analysis. Since supporting evidence is limited and conflicting at this time, the clinical significance of this alteration remains unclear.",['PS3'],Pathogenic
80,2247,"The p.R560K variant (also known as c.1679G>A), located in coding exon 12 of the CFTR gene, results from a G to A substitution at nucleotide position 1679. The arginine at codon 560 is replaced by lysine, an amino acid with highly similar properties. However, this change occurs in the last base pair of coding exon 12, which makes it likely to have some effect on normal mRNA splicing. This variant has been reported in multiple individuals with an elevated sweat chloride level in The Clinical and Functional TRanslation of CFTR (CFTR2) database (available at http://cftr2.org. Accessed 06/16/2022). This variant is considered to be rare based on population cohorts in the Genome Aggregation Database (gnomAD). This nucleotide position is highly conserved in available vertebrate species. This amino acid position is highly conserved in available vertebrate species. In silico splice site analysis predicts that this alteration will weaken the native splice donor site. In addition, as a missense substitution this is predicted to be deleterious by in silico analysis. Based on the supporting evidence, this alteration is interpreted as a disease-causing mutation.",['PS3'],Pathogenic
81,2463,"The p.R55G variant (also known as c.163A>G), located in coding exon 2 of the PTEN gene, results from an A to G substitution at nucleotide position 163. The arginine at codon 55 is replaced by glycine, an amino acid with dissimilar properties. This variant demonstrated WT-like intracellular protein abundance on one multiplex functional assay (Matreyek KA et al. Nat Genet, 2018 Jun;50:874-882). In a massively parallel functional assay using a humanized yeast model, lipid phosphatase activity for this variant was WT-like (Mighell TL et al. Am J Hum Genet, 2018 May;102:943-955). This amino acid position is highly conserved in available vertebrate species. In addition, this alteration is predicted to be deleterious by in silico analysis. Since supporting evidence is limited at this time, the clinical significance of this alteration remains unclear.",['BS3'],Benign
82,2473,"The c.185G>A (p.R62H) alteration is located in exon 4 (coding exon 2) of the PITX2 gene. This alteration results from a G to A substitution at nucleotide position 185, causing the arginine (R) at amino acid position 62 to be replaced by a histidine (H). This variant was not reported in population-based cohorts in the Genome Aggregation Database (gnomAD). This alteration was reported in multiple individuals or families with clinical features of PITX2-related Axenfeld-Rieger syndrome (Xia, 2004; Reis, 2012; Ma, 2020). This amino acid position is highly conserved in available vertebrate species. The p.R62H amino acid is located in the homeodomain. Molecular modeling predicted this alteration would have minor or no impact on the structure of PITX2 (Seifi, 2018). This alteration is predicted to be deleterious by in silico analysis. Based on the available evidence, this alteration is classified as likely pathogenic.",['BS3'],Benign
83,2550,"The c.2091_2092delAGins20 variant, located in coding exon 12 of the PMS2 gene, results from an in-frame deletion of AG and insertion of 20 nucleotides at positions 2091 to 2092. This results in the substitution of 2 amino acids and insertion of 6 additional amino acids at codons 697 to 698 (p.I697_V698delinsMDHGPWTM). This variant has been identified in a proband(s) whose Lynch syndrome-associated tumor demonstrated loss of PMS2 expression by immunohistochemistry (Ambry internal data). Based on internal structural analysis, I697_V698delinsMDHGPWTM is deleterious (Ambry internal data). In addition, this alteration is predicted to be deleterious by in silico analysis (Choi Y et al. PLoS ONE. 2012; 7(10):e46688). Based on the available evidence, the clinical significance of this variant remains unclear.",['PS3'],Pathogenic
84,2705,"The p.P1323H variant (also known as c.3968C>A), located in coding exon 20 of the SCN1A gene, results from a C to A substitution at nucleotide position 3968. The proline at codon 1323 is replaced by histidine, an amino acid with similar properties. In one case study, this variant was confirmed to be de novo in a 2-year-old with suspected Dravet syndrome, whose history included a hemiconvulsive febrile seizure at 6 months of age, generalized afebrile seizures at 9 months, and an occipital seizure (induced by intermittent photo stimulation) at 11 months (Specchio N et al. Seizure, 2014 Apr;23:309-13). This variant is located in the S4 transmembrane region and is predicted to be structurally deleterious (Wu J et al. Science, 2015 Dec;350). This amino acid position is highly conserved in available vertebrate species. In addition, this alteration is predicted to be deleterious by in silico analysis. Based on the majority of available evidence to date, this variant is likely to be pathogenic.",['PS3'],Pathogenic
85,2787,"The p.S294F variant (also known as c.881C>T), located in coding exon 7 of the SLC2A1 gene, results from a C to T substitution at nucleotide position 881. The serine at codon 294 is replaced by phenylalanine, an amino acid with highly dissimilar properties. Two different alterations located at the same position, p.S294P and p.S294V, have been identified in individuals with GLUT1-deficiency syndrome (Anheim M et al. J. Neurol., 2011 Feb;258:316-7; Anand G et al. Dev Med Child Neurol, 2011 Jul;53:664-8). This variant is located in TM7 of the GLUT1 transporter and is indicated to be structurally deleterious (Ambry internal data; Deng D et al. Nature, 2014 Jun;510:121-5; Kapoor K et al. Proc. Natl. Acad. Sci. U.S.A., 2016 Apr;113:4711-6). This amino acid position is highly conserved in available vertebrate species. In addition, this alteration is predicted to be deleterious by in silico analysis. Based on the majority of available evidence to date, this variant is likely to be pathogenic.",['PS3'],Pathogenic
86,2818,"The c.4675G>C variant (also known as p.E1559Q) is located in coding exon 13 of the BRCA1 gene. This variant results from a G to C substitution at nucleotide position 4675. The glutamic acid at codon 1559 is replaced by glutamine, an amino acid with highly similar properties. However, this change occurs in the last base pair of coding exon 13 which makes it likely to have some effect on normal mRNA splicing. In silico splice site analysis predicts that this alteration will weaken the native splice donor site and will result in the creation or strengthening of a novel splice donor site. RNA analysis showed that this alteration induces expression of a transcript lacking 11 nucleotides at the end of coding exon 13 (also called exon 15 in the literature-Ambry internal data; Davy G et al. Eur. J. Hum. Genet., 2017 10;25:1147-1154). Furthermore, a close match alteration at the same nucleotide position, BRCA1 c.4675G>A has been shown in multiple studies to have the same splice defect as this alteration (Wappenschmidt B et al. PLoS ONE, 2012 Dec; Wangensteen T et al. Hered Cancer Clin Pract, 2019 May;17:14; Koczkowska M et al. Cancers (Basel), 2018 Nov;10: ). This alteration was functional in a protein assay (Woods NT et al. NPJ Genom Med, 2016 Mar;1) and is predicted to be tolerated by in silico analysis. This variant is considered to be rare based on population cohorts in the Genome Aggregation Database (gnomAD). Based on the supporting evidence, this alteration is interpreted as a disease-causing mutation.",['BS3'],Benign
87,2831,"The c.1988A>G pathogenic mutation (also known as p.E663G), located in coding exon 17 of the MLH1 gene, results from an A to G substitution at nucleotide position 1988. The glutamic acid at codon 663 is replaced by glycine, an amino acid with similar properties. This variant has been identified in multiple probands who met Amsterdam I/II criteria for Lynch syndrome and tumor demonstrated high microsatellite instability with loss of MLH1 and/or PMS2 expression by immunohistochemistry (Ambry internal data). This nucleotide position is highly conserved in available vertebrate species. This variant is considered to be rare based on population cohorts in the Genome Aggregation Database (gnomAD). At the protein level, in vitro studies showed MMR activity of 69.7% and relative MLH1 expression of >75%. It also showed a positive mutator effect in all three yeast assays similar to wildtype MLH1 (Takahashi M et al. Cancer Res, 2007 May;67:4595-604). Additional studies have also shown this alteration to have an insignificant impact on MLH1 expression and MMR activity (Wanat JJ et al. Hum. Mol. Genet., 2007 Feb;16:445-52; Kosinski J et al. Hum Mutat, 2010 Aug;31:975-82; Abildgaard AB et al. Elife, 2019 11;8). At the RNA level, in silico splice site analysis predicts that this alteration will result in the creation or strengthening of a novel splice donor site. RNA studies have demonstrated that this alteration results in abnormal splicing in the set of samples tested (Dieumegard B et al. Br. J. Cancer, 2000 Feb;82:871-80, Ambry internal data). Based on the supporting evidence, this alteration is interpreted as a disease-causing mutation.",['BS3'],Benign
88,2841,"The p.Y2658H variant (also known as c.7972T>C), located in coding exon 16 of the BRCA2 gene, results from a T to C substitution at nucleotide position 7972. The tyrosine at codon 2658 is replaced by histidine, an amino acid with similar properties. This variant was similar to wildtype in a homology-directed DNA repair (HDR) assay (Ambry internal data). However, internal structural analysis indicates that this residue may disrupt an important protein interaction interface (Ambry internal data; Yang H. Science. 2002 Sep;297(5588):1837-48). This amino acid position is well conserved in available vertebrate species. In addition, this alteration is predicted to be deleterious by in silico analysis. Since supporting evidence is conflicting at this time, the clinical significance of this alteration remains unclear.",['BS3'],Benign
89,2860,"The p.R937H variant (also known as c.2810G>A), located in coding exon 20 of the ATP1A2 gene, results from a G to A substitution at nucleotide position 2810. The arginine at codon 937 is replaced by histidine, an amino acid with highly similar properties. This variant has been determined to be the result of a de novo mutation or germline mosaicism in one family with an isolated case of ATP1A2-related epilepsy. This alteration is located in the cation ATPase C domain and is indicated to be structurally deleterious (Ambry internal data; Shinoda T et al. Nature, 2009 May;459:446-50; Spiller S et al. World J Biol Chem, 2014 May;5:240-53). This amino acid position is highly conserved in available vertebrate species. In addition, this alteration is predicted to be deleterious by in silico analysis. Based on the majority of available evidence to date, this variant is likely to be pathogenic.",['PS3'],Pathogenic
90,2934,"The p.D2512Y variant (also known as c.7534G>T), located in coding exon 24 of the DSP gene, results from a G to T substitution at nucleotide position 7534. The aspartic acid at codon 2512 is replaced by tyrosine, an amino acid with highly dissimilar properties. In a study of subjects with arrhythmogenic right ventricular dysplasia (ARVD), this alteration was identified in the healthy control cohort (Kapplinger JD et al. J. Am. Coll. Cardiol., 2011 Jun;57:2317-27). Additionally, in vitro analysis noted this alteration did not show significant effect on protein function (Favre B et al. Circ Genom Precis Med, 2018 Sep;11:e002241). This amino acid position is highly conserved in available vertebrate species. In addition, this alteration is predicted to be deleterious by in silico analysis. Since supporting evidence is limited at this time, the clinical significance of this alteration remains unclear.",['BS3'],Benign
91,2940,"The c.1117_1119delAAC variant (also known as p.N373del) is located in coding exon 8 of the FH gene. This variant results from an in-frame AAC deletion at nucleotide positions 1117 to 1119. This results in the in-frame deletion of an asparagine at codon 373. This alteration has been observed in at least one individual with a personal and/or family history that is consistent with HLRCC-related disease (Ambry internal data). This amino acid position is highly conserved in available vertebrate species and the impacted region is critical for protein function (Ambry internal data). Based on internal structural analysis, N373del is deleterious and disrupts the active site of the protein (Ajalla Aleixo MA et al. FEBS J, 2019 May;286:1925-1940; Hicks KG et al. Science, 2023 Mar;379:996-1003). In addition, this alteration is predicted to be deleterious by in silico analysis (Choi Y et al. PLoS ONE. 2012; 7(10):e46688). This variant is considered to be rare based on population cohorts in the Genome Aggregation Database (gnomAD). As such, this alteration is classified as likely pathogenic.",['PS3'],Pathogenic
