,Unnamed: 0,Description,Corrected_Attribute,class
222,10867,"The p.V234M variant (also known as c.700G>A), located in exon 9 of the MUTYH gene, results from a G to A substitution at nucleotide position 700. The valine at codon 234 is replaced by methionine, an amino acid with highly similar properties. This variant has been reported in the heterozygous state in multiple colorectal cancer/polyposis and HNPCC/HNPCC-like cohorts to date (Peterlongo P et al. Carcinogenesis. 2006 Nov;27:2243-9; Fleischmann C et al. Int. J. Cancer. 2004 Apr;109:554-8; DeRycke MS et al. Mol Genet Genomic Med, 2017 Sep;5:553-569; Gordon AS et al. Am J Hum Genet, 2019 09;105:526-533; Patel SG et al. Hered Cancer Clin Pract, 2021 Jan;19:8). In two studies, it was reported to have at least partial function in bacterial and human cell-line based glycosylase and mutagenesis assays (Komine K et al. Hum. Mutat. 2015 Jul;36:704-11; Shinmura K et al. Hum. Mutat. 2016 Apr;37:350-3). This variant segregated with colon cancer or colon polyps in five siblings reported to have co-occurrence with a pathogenic MUTYH founder mutation, which was confirmed to be in trans through familial testing (Tsai GJ et al. Genet. Med. 2019 06;21:1435-1442). This variant has also been identified likely in trans with a MUTYH likely pathogenic or pathogenic variant in multiple individuals with clinical features of MUTYH-associated polyposis (Ambry internal data). Based on internal structural analysis, this variant is anticipated to disrupt a region of known function (Ambry internal data; Guan Y et al. Nat. Struct. Biol. 1998 Dec;5:1058-64; Manuel RC et al. J. Biol. Chem. 2004 Nov;279:46930-9). Of note, this variant is also designated as V220M in published literature. This amino acid position is not well conserved in available vertebrate species. In addition, this alteration is predicted to be deleterious by in silico analysis. Based on the majority of available evidence to date, this variant is likely to be pathogenic.","['PP1', 'PM3']",Pathogenic
223,10939,"The p.R385H variant (also known as c.1154G>A), located in coding exon 7 of the DICER1 gene, results from a G to A substitution at nucleotide position 1154. The arginine at codon 385 is replaced by histidine, an amino acid with highly similar properties. In one case-control study assessing probands with at least one cutaneous melanoma and two other primary cancers, this variant was not detected in 57 cases but was seen in the control group of 1358 individuals (Pritchard AL et al. PLoS One 2018 Apr;13(4):e0194098). This amino acid position is well conserved in available vertebrate species. In addition, this alteration is predicted to be tolerated by in silico analysis. Since supporting evidence is limited at this time, the clinical significance of this alteration remains unclear.",['PS4'],Pathogenic
224,10982,"Thep.E1121Gvariant (also known as c.3362A>G), located in coding exon 26 of theNF1gene, results from an A to G substitution at nucleotide position 3362. The glutamic acid at codon 1121 is replaced by glycine, an amino acid with similar properties. This alteration was reported in a father/son pair. Both of these individuals were described as having multiple caf-au-lait spots, however, no other NF1-related clinical features were noted. The authors state that this exonic alteration produced mosaicism of E1121G and exon 20 (coding exon 26) skipping at the mRNA level due to a decreased ratio of ESE/ESSs. The mosaicism of the post-transcriptional profile was further examined using real-time PCR with cDNA obtained from this family; this assay demonstrated the skipping rate of the mutant exon in both individuals. The authors conclude that this is a disease causing mutation (Xu W,Int. J. Mol. Med.2014 Jul; 34(1):53-60.).This variant was not reported in population based cohorts in the following databases: Database of Single Nucleotide Polymorphisms (dbSNP), NHLBI Exome Sequencing Project (ESP), and 1000 Genomes Project. In the ESP, this variant was not observed in 6503 samples (13006 alleles) with coverage at this position. To date, this alteration has been detected with an allele frequency of approximately 0.003% (greater than 30000 alleles tested) in our clinical cohort. Based on protein sequence alignment, this amino acid position is highly conserved in available vertebrate species. In addition, the in silico prediction for this alteration is inconclusive. Since supporting evidence is limited at this time, the clinical significance of p.E1121G remains unclear.",['PS3'],Pathogenic
225,11171,"The p.Q219* pathogenic mutation (also known as c.655C>T), located in coding exon 7 of the RAD51D gene, results from a C to T substitution at nucleotide position 655. This changes the amino acid from a glutamine to a stop codon within coding exon 7. In a case-control study involving 3429 epithelial ovarian cancer patients, this mutation was reported in cis with RAD51D p.G217* (c.649G>T) in one patient with high-grade serous epithelial ovarian cancer at age 73 (Song H et al. J. Clin. Oncol. 2015 Sep;33:2901-7). In addition to the clinical data presented in the literature, this alteration is expected to result in loss of function by premature protein truncation or nonsense-mediated mRNA decay. As such, this alteration is interpreted as a disease-causing mutation.","['BP2', 'PS4']",Both
226,11222,"The c.190C>T (p.R64*) alteration, located in exon 2 (coding exon 1) of the KANSL1 gene, consists of a C to T substitution at nucleotide position 190. This changes the amino acid from a arginine (R) to a stop codon at amino acid position 64. This alteration is expected to result in loss of function by premature protein truncation or nonsense-mediated mRNA decay. This KANSL1 variant is located in a genomically complex region; therefore, while this variant is expected to be deleterious, it is recommended to confirm that it has occurred de novo prior to classifying it as such (Koolen, 2016). Based on data from gnomAD, the T allele has an overall frequency of <0.001% (1/251488) total alleles studied. The highest observed frequency was 0.001% (1/113762) of European (non-Finnish) alleles. Based on insufficient or conflicting evidence, the clinical significance of this alteration remains unclear.","['PS2', 'PS3']",Pathogenic
227,11433,"The p.W1221* pathogenic mutation (also known as c.3662G>A), located in coding exon 24 of the ATM gene, results from a G to A substitution at nucleotide position 3662. This changes the amino acid from a tryptophan to a stop codon within coding exon 24. A different alteration resulting in the same stop codon (c.3663G>A) has been reported in multiple individuals diagnosed with ataxia-telangiectasia (Teraoka SN et al. Am J Hum Genet, 1999 Jun;64:1617-31; Jacquemin V et al. Eur J Hum Genet, 2012 Mar;20:305-12; Hoche F et al. Pediatr Neurol, 2014 Sep;51:297-310) and in a Spanish BRCA1/2 mutation-negative breast/ovarian cancer kindred (Velzquez C et al. Cancers (Basel), 2020 Aug;12:). This variant is considered to be rare based on population cohorts in the Genome Aggregation Database (gnomAD). In addition to the clinical data presented in the literature, this alteration is expected to result in loss of function by premature protein truncation or nonsense-mediated mRNA decay. As such, this alteration is interpreted as a disease-causing mutation.",['PS1'],Pathogenic
228,11488,"The c.571G>A (p.E191K) alteration is located in exon 6 (coding exon 5) of the ALPL gene. This alteration results from a G to A substitution at nucleotide position 571, causing the glutamic acid (E) at amino acid position 191 to be replaced by a lysine (K). Based on data from gnomAD, the A allele has an overall frequency of 0.25% (699/282574) total alleles studied. The highest observed frequency was 1.65% (414/25032) of European (Finnish) alleles. This variant, also described as E174K in literature, is a common founder mutation accounting for up to approximately 10% of disease-causing mutations in the ALPL gene (Hrasse, 2002; Mornet, 2021). This variant has been reported in the heterozygous (Hofmann, 2014; Taillandier, 2018; Mornet, 2021; Ambry internal data) and compound heterozygous (Henthorn, 1992; Schalin-Jntti, 2010; Hofmann, 2014; Zurutuza, 1999; Mornet, 2021; Sperelakis-Beedham, 2021) states in individuals with hypophosphatasia and low alkaline phosphatase, with the clinical severity correlating with degree of loss of function. This amino acid position is not well conserved in available vertebrate species. Multiple in vitro functional studies using transient expression in cells show slightly reduced activity consistent with a mild loss of function allele based on comparison to wild type and pathogenic controls (Hofmann, 2014; Zurutuza, 1999; Del Angel, 2020). This alteration is predicted to be deleterious by in silico analysis. Based on the available evidence, this alteration is classified as pathogenic.",['PM3'],Pathogenic
229,11638,"The p.I785V variant (also known as c.2353A>G), located in coding exon 10 of the BRCA2 gene, results from an A to G substitution at nucleotide position 2353. The isoleucine at codon 785 is replaced by valine, an amino acid with highly similar properties. This alteration was detected in an individual with prostate cancer and a family history of colorectal and thyroid cancers; this alteration displayed function equivalent to wild type in a mouse embryonic stem cell-based assay (Sirisena N et al. Breast Cancer Res. 2020 05;22:43). This amino acid position is poorly conserved in available vertebrate species. In addition, this alteration is predicted to be tolerated by in silico analysis. Since supporting evidence is limited at this time, the clinical significance of this alteration remains unclear.","['BS3', 'PP1']",Both
230,11792,Co-occurence with a mutation in another gene that clearly explains a proband's phenotype;In silico models in agreement (deleterious) and/or completely conserved position in appropriate species;Insufficient or conflicting evidence,['BP2'],Both
231,11807,"The p.I454R variant (also known as c.1361T>G), located in coding exon 8 of the MSH2 gene, results from a T to G substitution at nucleotide position 1361. The isoleucine at codon 454 is replaced by arginine, an amino acid with similar properties. One study reported this alteration in two unrelated individuals, one with endometrial and ovarian cancer diagnosed at age 42 whose family history met Amsterdam criteria and one with colorectal cancer diagnosed at age 39 who met Bethesda guidelines. The endometrial and colorectal tumors of these individuals showed high microsatellite instability (MSI-H) with absent MSH2 and MSH6 staining on immunohistochemistry (IHC). The individual with colorectal cancer was also positive for an MSH6 alteration. Furthermore, using family history, pathology, genetic information and supporting evidence from eight different in silico tools at the RNA and protein level, the investigators in this study classified p.I454R as probably damaging (Borras E et al. Cancer Prev. Res. (Phila) 2017 Oct;10(10):580-587). This alteration was also identified in another individual with a MSI-H rectal tumor that displayed loss of both MSH2/MSH6 on IHC and whose family history met Amsterdam II criteria for Lynch syndrome (Ambry internal data). In a massively parallel cell-based functional assay testing susceptibility to a DNA damaging agent, 6-thioguanine (6-TG), this variant was reported to be functionally deleterious (Jia X et al. Am J Hum Genet, 2021 01;108:163-175). This amino acid position is highly conserved in available vertebrate species. In addition, this alteration is predicted to be deleterious by in silico analysis. Based on the supporting evidence, this alteration is interpreted as a disease-causing mutation.","['PS3', 'PP1']",Pathogenic
232,11817,"The p.G4935R variant (also known as c.14803G>A), located in coding exon 104 of the RYR2 gene, results from a G to A substitution at nucleotide position 14803. The glycine at codon 4935 is replaced by arginine, an amino acid with dissimilar properties. This alteration has been reported as de novo in a sudden unexplained death cohort in a child who had a history of seizures, particularly with physical exertion, but had reportedly normal ECG results and no related family history (Medeiros-Domingo A et al. J. Am. Coll. Cardiol., 2009 Nov;54:2065-74; Johnson JN et al. J. Child Neurol., 2010 Jul;25:916-21; Tester DJ et al. Mayo Clin. Proc., 2012 Jun;87:524-39; Anderson JH et al. Circ Cardiovasc Genet, 2016 Jun;9:259-65). This amino acid position is highly conserved in available vertebrate species. In addition, this alteration is predicted to be deleterious by in silico analysis. Since supporting evidence is limited at this time, the clinical significance of this alteration remains unclear.",['PS2'],Pathogenic
233,11958,"The p.R19* pathogenic mutation (also known as c.55C>T), located in coding exon 2 of the MUTYH gene, results from a C to T substitution at nucleotide position 55. This changes the amino acid from an arginine to a stop codon within coding exon 2. The predicted stop codon occurs within the first 150 nucleotides of the MUTYH gene. This alteration may escape nonsense-mediated mRNA decay and/or be rescued by re-initiation (Rivas et al. Science. 2015 May 8;348(6235):666-9; Lindeboom et al. Nat. Genet. 2016 Oct;48(10):1112-8; Rhee et al. Sci. Rep. 2017 May 10;7(1):1653). However, the impacted region is critical for protein function (Ambry internal data). This mutation has been reported in individuals with clinical diagnoses of MUTYH-associated polyposis, including one male diagnosed with colon cancer at age 43 who had 60-70 total colon polyps and co-occurrence with MUTYH c.1147delC (Nielsen M et al. Gastroenterology. 2009 Feb;136:471-6; Jones N et al. Gastroenterology. 2009 Aug;137:489-94; Vogt S et al. Gastroenterology. 2009 Dec;137:1976-85; Li CG et al. J. Gastroenterol. Hepatol. 2017 Oct;32(10):1723-1729). Based on the supporting evidence, this alteration is interpreted as a disease-causing mutation.",['BP2'],Both
234,11997,"The p.R156H variant (also known as c.467G>A), located in coding exon 4 of the TP53 gene, results from a G to A substitution at nucleotide position 467. The arginine at codon 156 is replaced by histidine, an amino acid with highly similar properties. This alteration was reported in the germline of a 17-year-old female with adrenocortical carcinoma (Juhlin CC et al. J. Clin. Endocrinol. Metab. 2015 Mar;100(3):E493-502). Additionally, this alteration was detected in the germline of a severely affected child with Li-Fraumeni syndrome (LFS) who also harbored two additional TP53 alterations and had a maternal family history consistent with LFS. Individual analysis of the two alterations found in cis (p.R156H and p.R267Q) showed only weak mutant phenotypes in functional studies, whereas the double mutant showed complete loss of transactivation activity and growth suppression. Authors suggest that p.R156H may cause a partial defect, with a second alteration needed on the same allele to fully inactivate the protein (Quesnel S et al. Oncogene. 1999 Jul;18(27):3970-8; Soussi T et al. Hum. Mutat. 2005 Jan;25(1):6-17). This same combination of variants (p.R156H and p.R267Q) was observed in a male diagnosed with sarcoma at age 40 and acute myeloid leukemia at age 42 (Swaminathan M et al. Cold Spring Harb Mol Case Stud 2019 02;5(1). This variant is in the DNA binding domain of the TP53 protein and is reported to have partially functional or wild type-like transactivation activity in two different yeast based assays (Kato S et al. Proc. Natl. Acad. Sci. USA. 2003 Jul;100(14):8424-9; Monti P et al. Mol. Cancer Res. 2011 Mar;9(3):271-279). Additional studies conducted in human cell lines show retained growth suppression (Kotler E et al. Mol.Cell 2018 Jul;71:178-190.e8; Giacomelli AO et al. Nat. Genet. 2018 Oct;50:1381-1387). This amino acid position is not well conserved in available vertebrate species. In addition, this alteration is predicted to be deleterious by in silico analysis. This alteration has been observed in numerous individuals who do not have a personal or family history that is consistent with or suggestive of TP53-associated disease (Ambry internal data). Based on the available evidence to date, the clinical significance of this alteration remains unclear.",['PS3'],Pathogenic
235,12048,"The p.R1898H variant (also known as c.5693G>A), located in coding exon 27 of the SCN5A gene, results from a G to A substitution at nucleotide position 5693. The arginine at codon 1898 is replaced by histidine, an amino acid with highly similar properties. This alteration has been detected in a dilated cardiomyopathy cohort, in an individual with confirmed myocarditis, and an individual with features of arrhythmogenic right ventricular cardiomyopathy (Haas J et al. Eur. Heart J., 2015;36:1123-35a; Te Riele AS et al. Cardiovasc. Res., 2017;113:102-111; Nelson McMillan K. Artif Organs. 2019;43(1):21-29). This variant (referred to as p.R1865H) co-occurred with a de novo KCNH2 variant in an individual with overlapped phenotypes of LQTS and sinoatrial node dysfunction, while two reportedly unaffected relatives also had this SCN5A variant (Yang Z et al. Ann Noninvasive Electrocardiol. 2022 Jan;27(1):e12889). This variant has also been detected in a self-reported healthy cohort; however, details were limited (Bajaj A et al. Hum Genomics. 2022 Aug;16(1):30). One study indicated this alteration may have an impact on sodium channel function (Te Riele AS et al. Cardiovasc. Res., 2017;113:102-111). This amino acid position is highly conserved in available vertebrate species. In addition, this alteration is predicted to be deleterious by in silico analysis. Since supporting evidence is limited at this time, the clinical significance of this alteration remains unclear.","['PS2', 'PP1']",Pathogenic
236,12134,"The c.815-27T>C intronic alteration consists of a T to C substitution 27 nucleotides before coding exon 10 in the NUBPL gene and is predicted to affect the native branch site. Based on data from the Genome Aggregation Database (gnomAD) database, the NUBPL c.815-27T>C alteration was observed in 0.35% (992/280082) of total alleles studied (including 10 homozygotes), with a frequency of 1.24% (310/24978) in the European (Finnish) subpopulation. The [c.166G>A (p.G56R); c.815-27T>C] complex allele has been reported in the homozygous state, compound heterozygous state, and confirmed in trans with a second pathogenic allele in multiple unrelated patients with mitochondrial encephalomyopathy (Calvo, 2010; Kevelam, 2013). Emerging evidence is suggestive that the NUBPL [c.166G>A (p.G56R); c.815-27T>C] complex allele is likely pathogenic when these alterations are in cis; however, the clinical significance of these alterations in isolation remains uncertain. The c.815-27T nucleotide is highly conserved in available vertebrate species. Functional analysis of cultured fibroblasts from a patient bearing the [c.166G>A (p.G56R); c.815-27T>C] complex allele in trans with a complex rearrangement, as well as a control patient who was heterozygous for only the c.815-27T>C alteration, demonstrated an aberrant RT-PCR pattern with three distinct transcripts: wild-type, a lengthened transcript resulting from a cryptic splice site which introduces an additional 72 bp and results in a frameshift (p.G272Vfs*11), as well as a truncated transcript generated due to exon 10 skipping resulting in a frameshift (p.D273Qfs*31) (Tucker, 2012). Analysis by qRT-PCR and Western blot showed that the heterozygous control with only the c.815-27T>C alteration had reduced mRNA expression (74%) and protein expression (59%) compared to wild type controls, and the patient with the [c.166G>A (p.G56R); c.815-27T>C] complex allele and complex rearrangement on the other allele had more significant reduction in mRNA expression (15%) and undetectable protein expression (Tucker, 2012). No defective function was identified when the protein with the G56R missense change was over-expressed (Tucker, 2012). The p.D273Qfs*31 transcript is completely non-functional in yeast assays (Wydro, 2013; Maclean, 2018). In silico splice site analysis predicts that the c.815-27T>C alteration will weaken the native splice acceptor site and will result in the creation or strengthening of a novel splice acceptor site. Based on the available evidence, this alteration is classified as likely pathogenic.",['BP2'],Both
237,12248,"The p.R661W pathogenic mutation with reduced penetrance (also known as c.1981C>T), located in coding exon 20 of the RB1 gene, results from a C to T substitution at nucleotide position 1981. The arginine at codon 661 is replaced by tryptophan, an amino acid with dissimilar properties. This alteration has been reported in several RB families showing reduced penetrance where there are some individuals who are unaffected carriers; where some have unilateral RB; where some have bilateral RB; and some have regressed RB tumors (Onadim Z et al. Proc. Natl. Acad. Sci. U.S.A.. 1992 Jul;89:6177-81; Dommering CJ et al. J. Med. Genet. 2014 Jun;51:366-74; Eloy P et al. PLoS Genet. 2016 Feb;12:e1005888). In another study, the p.R661W pathogenic mutation accounted for approximately 3% (7/235) of unrelated retinoblastoma probands with germline RB1 mutations and approximately 13% (4/30) of germline mutations identified in probands with unilateral retinoblastoma (Richter S et al. Am. J. Hum. Genet. 2003 Feb;72:253-69). In addition, the p.R661W alteration has been shown to result in reduced, but not abolished, retinoblastoma protein activity (Whitaker LL et al. Mol. Cell. Biol. 1998 Jul;18:4032-42) and confers a decreased, albeit significant tumor risk (DiCiommo D et al. Semin. Cancer Biol. 2000 Aug;10:255-69). In a recent study including ten families with the p.R661W alteration, authors reported that if this alteration was maternally inherited the probability of being affected with RB was just under 10% whereas if this alteration was paternally inherited the probability of being affected with RB was almost 68%. They speculate that this parent-of-origin effect is due to maternal imprinting of an internal promoter which produces an alternative RB1 transcript and may contribute to the reduced penetrance of this mutation (Eloy P et al. PLoS Genet. 2016 Feb;12:e1005888; Kanber D et al. PLoS Genet. 2009 Dec;5:e1000790). Based on the supporting evidence, p.R661W is interpreted as a disease-causing mutation with reduced penetrance.",['BS4'],Benign
238,12330,"The c.699G>A (p.W233*) alteration, located in exon 5 (coding exon 4) of the TBX6 gene, consists of a G to A substitution at nucleotide position 699. This changes the amino acid from a tryptophan (W) to a stop codon at amino acid position 233. This alteration is expected to result in loss of function by premature protein truncation or nonsense-mediated mRNA decay. This variant was not reported in population-based cohorts in the Genome Aggregation Database (gnomAD). This alteration was reported in trans with the T-C-A risk haplotype (the co-occurrence of three common SNPs: rs2289292, rs3809624, and rs3809627) in an individual with congenital hemivertebrae, block vertebrae, and a missing left eleventh rib (Takeda, 2017; Liu, 2019). Functional analysis of the p.W233* alteration showed significantly decreased transcriptional activities compared to the wild-type (Chen, 2020). Based on the available evidence, this alteration is classified as pathogenic.",['BP2'],Both
239,12429,"The p.G589S variant (also known as c.1765G>A), located in coding exon 15 of the KCNQ1 gene, results from a G to A substitution at nucleotide position 1765. The glycine at codon 589 is replaced by serine, an amino acid with similar properties. This variant has been detected in an individual from a long QT syndrome (LQTS) cohort; however, details were limited (Gao Y et al. Cardiology, 2016 Oct;133:73-8). This variant was detected in the compound heterozygous state (in trans) with a KCNQ1 nonsense alteration in a symptomatic individual with LQTS who had normal hearing; the p.G589S variant was also detected in unaffected relatives with normal ECGs (Lin Y et al. Ann Noninvasive Electrocardiol, 2020 Jan;25:e12694). This amino acid position is highly conserved in available vertebrate species. In addition, this alteration is predicted to be deleterious by in silico analysis. Since supporting evidence is limited at this time, the clinical significance of this alteration remains unclear.",['PM3'],Pathogenic
