,Unnamed: 0,Description,Corrected_Attribute,class
0,228,"The c.1147dupC (p.H383Pfs*103) alteration, located in coding exon 6 of the SF3B4 gene, consists of a duplication of C at position 1147, causing a translational frameshift with a predicted alternate stop codon after 103 amino acids. Frameshift alterations are typically deleterious in nature (Richards, 2015). The alteration is not observed in healthy cohorts: Based on data from the NHLBI Exome Sequencing Project (ESP), the SF3B4 c.1147DUPC alteration was not observed among 6,476 individuals tested. Allele frequency data for this nucleotide position are not currently available from the 1000 Genomes Project and the alteration is not currently listed in the Database of Single Nucleotide Polymorphisms (dbSNP). The alteration has been observed in affected individuals: This alteration was previously reported in a one year old male and his 28 year old mother. Both individuals had dwonslanted palperbral fissures, micrognathia, abnormal soft palate, abnormal ears, and hearing loss. The son was absent his right thumb and had a small left thumb. The mother had small thumbs and bilateral radioulnar synostosis (Bernier 2012). Based on the available evidence, this alteration is classified as pathogenic.",['PS3'],Pathogenic
1,233,"The p.A2603T variant (also known as c.7807G>A), located in coding exon 16 of the BRCA2 gene, results from a G to A substitution at nucleotide position 7807. The alanine at codon 2603 is replaced by threonine, an amino acid with similar properties. This alteration was functional in a drug sensitivity assay (Ikegami M et al. Nat Commun, 2020 05;11:2573). This amino acid position is highly conserved in available vertebrate species. In addition, this alteration is predicted to be deleterious by in silico analysis. Since supporting evidence is limited at this time, the clinical significance of this alteration remains unclear.",['BS3'],Benign
2,249,"The p.L21P variant (also known as c.62T>C), located in coding exon 1 of the JAG1 gene, results from a T to C substitution at nucleotide position 62. The leucine at codon 21 is replaced by proline, an amino acid with some similar properties. This variant was not reported in population based cohorts in the following databases: Database of Single Nucleotide Polymorphisms (dbSNP), NHLBI Exome Sequencing Project (ESP), and 1000 Genomes Project. In the ESP, this variant was not observed in 5061 samples (10122 alleles) with coverage at this position. This amino acid position is highly conserved on sequence alignment in vertebrates. In addition, the in silico prediction for this alteration is inconclusive. It is reported that 56-70% of mutations in JAG1 are de novo (Guegan et al. Clin Genet. 2012 Jul;82(1):33-40). Since supporting evidence is limited at this time, the clinical significance of p.L21P remains unclear.",['PM6'],Pathogenic
3,283,"The c.125-9831_236del9943 gross deletion includes at least a portion of coding exon 3 in the POT1 gene. This variant has been observed in at least one individual with a personal and/or family history that is consistent with POT1-related tumor predisposition syndrome (Ambry internal data).This gross deletion occurs near the 5 end of the POT1 gene and may escape NMD and/or be rescued by reinitiation (Rivas et al. Science. 2015 May 8;348(6235):666-9; Lindeboom et al. Nat Genet. 2016 Oct;48(10):1112-8; Rhee et al. Sci Rep. 2017 May 10;7(1):1653). The clinical impact of such events is currently unknown. However, gross deletions are typically deleterious in nature. Based on the majority of available evidence to date, this variant is likely to be pathogenic.",['PS3'],Pathogenic
4,336,"The p.M3118T variant (also known as c.9353T>C), located in coding exon 24 of the BRCA2 gene, results from a T to C substitution at nucleotide position 9353. The methionine at codon 3118 is replaced by threonine, an amino acid with similar properties. This alteration was reported in a Japanese breast cancer family (Katagiri T et al. J. Hum. Genet., 1998;43:42-8). It was also reported in a Japanese female diagnosed with osteosarcoma of the leg at age 16 and bilateral breast cancers at ages 32 and 34; her mother was diagnosed with breast cancer at age 45. This case report did not mention whether the patient had undergone TP53 germline testing (Kuno T et al. Breast Cancer, 1999 Jan;6:51-54). This alteration was detected in a cohort of 88 African American individuals with a personal and/or family history of breast and/or ovarian cancer (McDonald JT et al. PLoS One, 2022 Oct;17:e0273835). This alteration was also reported in a patient with breast cancer who was also found to carry a pathogenic mutation in the PALB2 gene (Cheng JM et al. Breast Cancer Res Treat, 2023 Jun;199:389-397). In one study, this variant was reported in 1/60,466 breast cancer cases and in 0/53,461 controls (Dorling et al. N Engl J Med. 2021 02;384:428-439). In an assay testing homologous recombination function, this variant showed a functionally normal result (Guo Q et al. J Hum Genet, 2023 Dec;68:849-857). This amino acid position is not well conserved in available vertebrate species, and threonine is the reference amino acid in other vertebrate species. In addition, the in silico prediction for this alteration is inconclusive. Based on the available evidence, the clinical significance of this variant remains unclear.",['PP1'],Pathogenic
5,359,"The c.913_915delTTC (p.F305del) alteration, located in coding exon 8 of the ATP1A2 gene, results from an in-frame TTC deletion at nucleotide positions c.913 to c.915. This results in the deletion of a Phenylalanine residue at codon 305. Based on the available evidence, the ATP1A2 c.913_915delTTC (p.F305del) alteration is classified as likely pathogenic for autosomal dominant ATP1A2-related neurologic disorders; however, its clinical significance for autosomal recessive ATP1A2-related cortical malformation syndrome is uncertain. This variant was not reported in population-based cohorts in the Genome Aggregation Database (gnomAD). This variant was reported as a de novo occurrence in one individual with features of ATP1A2-related hemiplegic migraine, as well as detected in the heterozygous state in another individual and in two families with hemiplegic migraine (Riant, 2010; external communication). This amino acid position is highly conserved in available vertebrate species. Based on internal structural analysis, p.F305del is deleterious. This alteration is predicted to be deleterious by in silico analysis (Choi, 2012). Based on the available evidence, this alteration is classified as likely pathogenic.",['PS3'],Pathogenic
6,386,"The c.501_503delGAA (p.K168del) alteration is located in coding exon 6 of the EBF3 gene. This alteration consists of an in-frame deletion of 3 nucleotides between nucleotide positions c.501 and c.503, resulting in the deletion of 1 residue. Based on data from the Genome Aggregation Database (gnomAD), the EBF3 c.501_503delGAA alteration was not observed, with coverage at this position. This amino acid position is completely conserved on sequence alignment. The p.K168del amino acid is located in a zinc finger motif which is part of the DNA-binding domain. This motif is highly conserved across the COE family of proteins (reviewed in Chao, 2016)._x000D_ _x000D_ Chao, HT Am J Hum Genet. 2017 Jan 5;100(1):128-137. PMID: 28017372 The p.K168del alteration is predicted to be deleterious with a score of -11.620 by PROVEAN in silico analysis. Based on insufficient or conflicting evidence, the clinical significance of this alteration remains unclear.",['PP1'],Pathogenic
7,400,"The p.K1343E variant (also known as c.4027A>G), located in coding exon 10 of the BRCA2 gene, results from an A to G substitution at nucleotide position 4027. The lysine at codon 1343 is replaced by glutamic acid, an amino acid with similar properties. This alteration was detected in a patient with a history of thyroid adenoma and breast cancer (age 62), who developed possible therapy-related AML 2 years later. Family history included melanoma and cancer, primary site unknown (Schulz, E et al. J Med Genet. 2012 Jul;49(7):422-8). This amino acid position is not well conserved in available vertebrate species. In addition, this alteration is predicted to be tolerated by in silico analysis. Since supporting evidence is limited at this time, the clinical significance of this alteration remains unclear.",['PP1'],Pathogenic
8,402,"The c.521dupA pathogenic mutation, located in coding exon 4 of the CDH1 gene, results from a duplication of A at position 521, causing a translational frameshift with a predicted alternate stop codon (p.N174Kfs*25). This mutation has been reported in a woman with lobular breast cancer diagnosed at age 42 whose mother also developed lobular breast cancer at age 28. There were no other known breast or gastric cancers in the family (Masciari S et al. J Med Genet. 2007 Nov;44(11):726-31). It was also seen in two breast cancer patients who underwent multigene panel testing (Desmond A et al. JAMA Oncol. 2015 Oct;1(7):943-51). This mutation is also referred to as c.517insA in the literature. This variant is considered to be rare based on population cohorts in the Genome Aggregation Database (gnomAD). In addition to the clinical data presented in the literature, this alteration is expected to result in loss of function by premature protein truncation or nonsense-mediated mRNA decay. As such, this alteration is interpreted as a disease-causing mutation.",['PP1'],Pathogenic
9,408,"The c.6938-1G>A intronic variant results from a G to A substitution one nucleotide upstream from coding exon 12 of the BRCA2 gene. This variant has been detected in a Romanian breast cancer family (Negura L et al. Revista Romana de Medicina de Laborator. 2012 Dec;20(4):317-26). This nucleotide position is highly conserved in available vertebrate species. Using the BDGP and ESEfinder splice site prediction tools, this alteration is predicted to abolish the native splice acceptor site; however, direct evidence is unavailable. Alterations that disrupt the canonical splice site are expected to cause aberrant splicing, resulting in an abnormal protein or a transcript that is subject to nonsense-mediated mRNA decay. As such, this alteration is classified as likely pathogenic.",['PP1'],Pathogenic
10,427,"The p.D214G variant (also known as c.641A>G), located in coding exon 8 of the BRCA1 gene, results from an A to G substitution at nucleotide position 641. The aspartic acid at codon 214 is replaced by glycine, an amino acid with a few similar properties. This alteration has been detected in conjunction with the BRCA1 alteration c.594-2A>C (IVS9-2A>C) in cis and was predicted to cause a partial exon 10 deletion by an in silico tool; however, a splicing assay showed that a transcript with a partial exon 10 deletion was not detected (Tesoriero AA et al. Hum Mutat. 2005;26:495). This alteration has been detected in an individual diagnosed with breast cancer at age 39 (she also carried the BRCA1 c.594-2A>C and c.4956G>A alterations) whose mother was diagnosed with breast cancer in her late 40s, an individual with bilateral breast cancer, and an individual with an uterine serous carcinoma (Southey MC et al. Br J Cancer. 1999;79:34-9; Borg A et al. Hum Mutat. 2010 Mar;31(3):E1200-40; Pennington KP et al. Cancer. 2013;119:332-8). In one study, large-scale genetic and clinical resources from the ENIGMA, CIMBA and BCAC consortia were used to assess the pathogenicity of the haplotype (c.594-2A>C linked to c.641A>G) carrying this variant. This resulted in the combined odds for causality of 3.23x10-8 for this haplotype, considering case-control, segregation, and breast tumor pathology information. Their data indicate that c.594-2A>C is always in cis with c.641A>G (de la Hoya M et al Hum Mol Genet. 2016; Mar). Of note, this alteration is also designated as and 760A>G in published literature. This amino acid position is poorly conserved in available vertebrate species. In addition, this alteration is predicted to be tolerated by in silico analyses. Based on the available evidence, the clinical significance of this variant remains unclear.",['BP2'],Both
11,440,"The c.1317_1321dupAGCCG (p.A441Efs*28) alteration, located in exon 15 (coding exon 14) of the PNKP gene, consists of a duplication of AGCCG at position 1317, causing a translational frameshift with a predicted alternate stop codon after 28 amino acids. This alteration occurs at the 3' terminus of the PNKP gene, is not expected to trigger nonsense-mediated mRNA decay, and impacts the last 15% of the protein. Premature stop codons are typically deleterious in nature, the impacted region is critical for protein function, and a significant portion of the protein is affected (Ambry internal data). This allele was reported in one heterozygous individual in population-based cohorts in the Genome Aggregation Database (gnomAD). This alteration was detected in conjunction with another variant in PNKP in an individual with clinical features of PNKP-related neurodevelopmental disorder (Bras, 2015). Based on internal structural analysis, p.A441Efs*28 is deleterious. This variant is destabilizing to the local structure and disrupts a significant portion of a domain (Jilani, 1999; Karimi-Busheri, 1999; Koch, 2004; Mani, 2010; Aceytuno, 2017). Based on the available evidence, this alteration is classified as pathogenic.",['PS3'],Pathogenic
12,442,"The c.-12_8del20 variant (also known as p.M1?) is located in coding exon 1 of the AXIN2 gene and results from a deletion of 20 nucleotides at positions c.-12 to c.8. This removes the methionine residue at the initiation codon. This alteration was identified in 1/10030 consecutive patients referred for evaluation by an NGS hereditary cancer panel (Susswein LR et al. Genet. Med., 2016 08;18:823-32). This variant has been reported in a French family with oligodontia (Leclerc J et al. Genes Chromosomes Cancer. 2023 Apr;62(4):210-222). This alteration has been observed in at least one individual with a personal and/or family history that is consistent with AXIN2-related disease but also in unaffected individuals (Ambry internal data). Variations that modify the initiation codon (ATG) are expected to result in either loss of translation initiation, N-terminal truncation, or cause a shift in the mRNA reading frame; however, there is an alternate in-frame methionine 4 amino acids from the initiation site, which may result in N-terminal truncation of unknown significance. Since supporting evidence is limited at this time, the clinical significance of this alteration remains unclear.",['PP1'],Pathogenic
13,468,"The p.L73R variant (also known as c.218T>G), located in coding exon 3 of the MLH1 gene, results from a T to G substitution at nucleotide position 218. The leucine at codon 73 is replaced by arginine, an amino acid with dissimilar properties. This alteration has been reported in a homozygous state in a male of Polynesian ancestry whose clinical history was consistent with constitutional mismatch repair deficiency (CMMR-D) . This individual developed glioblastoma multiforme (3 years) and T-cell lymphoblastic lymphoma (5.5 years); he was also noted to have near complete agenesis of the corpus callosum, interhemispheric and intracerebral cysts, and right subcortical and periventricular heterotopia and multiple cafe-au-lait spots. The maternal family history was also positive for colorectal cancer (Baas AF et al. Eur. J. Hum. Genet. 2013 Jan; 21(1):55-61). This amino acid position is well conserved through mammals. In addition, this alteration is predicted to be deleterious by in silico analysis. In addition, this alteration is predicted to be deleterious by MAPP-MMR in silico analyses (Chao E et al. Hum Mutat. 2008 Jun;29(6):852-60). Based on the majority of available evidence to date, this variant is likely to be pathogenic.",['PP1'],Pathogenic
14,473,"The c.1662-2A>G intronic variant results from an A to G substitution two nucleotides upstream from coding exon 11 in the MSH2 gene. This variant was detected in 1/537 French families tested for Lynch syndrome (Bonadona V et al. JAMA, 2011 Jun;305:2304-10). This variant was also reported in Argentinian Lynch syndrome family (Rossi BM et al. BMC Cancer, 2017 Sep;17:623). In addition, this variant was identified in conjunction (phase unknown) with a truncating pathogenic MSH2 mutation, c.1665del (p.Lys555Asnfs*2), in a Chinese hereditary nonpolyposis colorectal cancer family (Wang XL et al. World J Gastroenterol, 2006 Jul;12:4074-7). Furthermore, this variant has been identified in a proband whose Lynch syndrome-associated tumor demonstrated loss of MSH2/MSH6 expression by immunohistochemistry (Ambry internal data). This variant is considered to be rare based on population cohorts in the Genome Aggregation Database (gnomAD). This nucleotide position is highly conserved in available vertebrate species. In silico splice site analysis predicts that this alteration will weaken the native splice acceptor site; however, direct evidence is insufficient at this time (Ambry internal data). In addition to the clinical data presented in the literature, alterations that disrupt the canonical splice site are expected to cause aberrant splicing, resulting in an abnormal protein or a transcript that is subject to nonsense-mediated mRNA decay. As such, this alteration is classified as likely pathogenic.",['PP1'],Pathogenic
15,478,"The p.K2442R variant (also known as c.7325A>G), located in coding exon 45 of the DNAH11 gene, results from an A to G substitution at nucleotide position 7325. The lysine at codon 2442 is replaced by arginine, an amino acid with highly similar properties. This variant was previously reported in the SNPDatabase as rs114286628. Based on data from the 1000 Genomes Project, the G allele has an overall frequency of approximately 0.14% (3/2098) total alleles studied. The highest observed frequency was 1.14% (2/176) Yoruba alleles. Based on data from the NHLBI Exome Sequencing Project (ESP), the G allele has an overall frequency of approximately 0.05% (6/11828) total alleles studied, having been observed in 0.16% (6/3654) African American alleles. This amino acid position is highly conserved in available vertebrate species. In addition, this alteration is predicted to be deleterious by SIFT. Since supporting evidence is limited at this time, the clinical significance of this variant remains unclear.",['PS3'],Pathogenic
16,487,"The p.D2720H variant (also known as c.8158G>C), located in coding exon 55 of the ATM gene, results from a G to C substitution at nucleotide position 8158. The aspartic acid at codon 2720 is replaced by histidine, an amino acid with similar properties. This alteration has been identified in high-risk non-BRCA1/2 family (Li J et al. J Med Genet, 2016 Jan;53:34-42). This amino acid position is highly conserved in available vertebrate species. In addition, this alteration is predicted to be deleterious by in silico analysis. Based on the available evidence, the clinical significance of this variant remains unclear.",['PP1'],Pathogenic
17,500,"The c.845G>A (p.C282Y) alteration is located in coding exon 4 of the HFE gene. This alteration results from a G to A substitution at nucleotide position 845, causing the cysteine (C) at amino acid position 282 to be replaced by a tyrosine (Y). Based on data from gnomAD, the A allele has an overall frequency of 3.38% (9544/282608) total alleles studied. The highest observed frequency was 5.77% (7435/128950) of European (non-Finnish) alleles. This alteration is the most common cause of hereditary hemochromatosis (Allen, 2008). In homozygous individuals, up to 50% may develop iron overload, with 10-33% developing hemochromatosis-associated morbidity (EASL, 2010). Men appear to have a higher risk for disease development than women. In homozygous men, 84% display elevated transferrin-iron saturation and 88% have elevated serum ferritin concentration. In comparison, fewer homozygous women have elevated transferrin-iron saturation and serum ferritin concentration (73% and 57%, respectively). However, when p.C282Y is compound heterozygous with another pathogenic alteration, disease penetrance is significantly lower (Adams, 1997). This amino acid position is highly conserved in available vertebrate species. Functional studies have shown that this alteration leads to impaired intracellular transport of the protein and degradation before reaching the cell surface (Feder, 1997; Waheed, 1997). This alteration is predicted to be deleterious by in silico analysis. Based on the available evidence, this alteration is classified as pathogenic.",['PS3'],Pathogenic
18,513,No disease association in appropriately sized case-control study(ies),['PS4'],Pathogenic
19,515,"The p.T2331A variant (also known as c.6991A>G), located in coding exon 12 of the BRCA2 gene, results from an A to G substitution at nucleotide position 6991. The threonine at codon 2331 is replaced by alanine, an amino acid with similar properties. This alteration was classified as likely benign in a multifactorial model of variant interpretation that incorporates co-segregation, family history, co-occurrence and tumor pathology and case-control data (Parsons MT et al. Hum Mutat, 2019 Sep;40:1557-1578). This alteration scored as functional in a mESC-based survival assay (Sahu S et al. PLoS Genet, 2023 Sep;19:e1010940). This amino acid position is not well conserved in available vertebrate species. In addition, the in silico prediction for this alteration is inconclusive. Based on the available evidence, the clinical significance of this variant remains unclear.",['BS3'],Benign
20,524,"The p.R474W variant (also known as c.1420C>T), located in coding exon 13 of the MLH1 gene, results from a C to T substitution at nucleotide position 1420. The arginine at codon 474 is replaced by tryptophan, an amino acid with dissimilar properties. This variant demonstrated no effect on splicing in one ex vivo assay (Tournier I et al. Hum. Mutat. 2008 Dec;29:1412-24). This variant was also observed in 1/3251 individuals who met eligibility criteria for hereditary breast and ovarian cancer syndrome (Lerner-Ellis J et al. J Cancer Res Clin Oncol, 2021 Mar;147:871-879). This amino acid position is highly conserved in available vertebrate species. In addition, this alteration is predicted to be deleterious by in silico analysis. Based on the available evidence, the clinical significance of this variant remains unclear.",['BS3'],Benign
21,565,"The c.5595_5596delAT pathogenic mutation, located in coding exon 10 of the BRCA2 gene, results from a deletion of two nucleotides at nucleotide positions 5595 and 5596, causing a translational frameshift with a predicted alternate stop codon (p.F1866Yfs*6). This deletion was first reported in an HBOC family in the Netherlands (Ligtenberg MJ et al. Br. J. Cancer. 1999 Mar;79:1475-8). It has also been reported in one individual with pancreatic cancer who had no history of tobacco use (Lucas AL et al. Cancer. 2014 Jul;120:1960-7). Of note, this alteration is also designated as 5823delAT in the published literature. In addition to the clinical data presented in the literature, this alteration is expected to result in loss of function by premature protein truncation or nonsense-mediated mRNA decay. As such, this alteration is interpreted as a disease-causing mutation.",['PP1'],Pathogenic
22,571,"The p.Q939* pathogenic mutation (also known as c.2815C>T), located in coding exon 4 of the MSH6 gene, results from a C to T substitution at nucleotide position 2851. This changes the amino acid from a glutamine to a stop codon within coding exon 4. This mutation was detected in an individual diagnosed with colon cancer at age 47 who had a family history of colon cancer (Kets CM et al. Br J Cancer. 2006 Dec 18;95(12):1678-82) as well as in an individual with endometrioid endometrial cancer diagnosed at age 60 (Jri B et al. Oncotarget, 2015 Dec;6:41108-22). This mutation was also detected in an individual diagnosed with colon cancer at ages 38, 51, 58 followed by cancer of the ileum at age 65 and urothelial cancer at age 69. The ileum tumor showed microsatellite instability and a loss of MSH6 staining on IHC. This individual also had a family history of HNPCC associated cancers (Overbeek LI et al. Br J Cancer. 2007 May 21;96(10):1605-12). In another study, this variant was reported in 1/60,466 breast cancer cases and in 0/53,461 controls (Dorling et al. N Engl J Med, 2021 02;384:428-439). In addition to the clinical data presented in the literature, this alteration is expected to result in loss of function by premature protein truncation or nonsense-mediated mRNA decay. As such, this alteration is interpreted as a disease-causing mutation.",['PP1'],Pathogenic
23,590,"The p.R99W variant (also known as c.295C>T), located in coding exon 2 of the PHOX2B gene, results from a C to T substitution at nucleotide position 295. The arginine at codon 99 is replaced by tryptophan, an amino acid with dissimilar properties. This alteration occurred de novo in a family tested by our laboratory. This amino acid position is highly conserved in available vertebrate species. In addition, this alteration is predicted to be deleterious by in silico analysis. Internal structural analysis has revealed that this alteration would disrupt the DNA binding domain of the protein. Based on the majority of available evidence to date, this variant is likely to be pathogenic.",['PS2'],Pathogenic
